{
  "type": "verification_report",
  "version": "0.1",
  "snapshot_id": "snap_test_001",
  "results": {
    "ciphertext_hash_verified": true,
    "owner_signature_verified": true,
    "witness_signatures_verified": true,
    "ledger_hash_chain_verified": true,
    "recipient_key_grant_verified": true
  },
  "attestation_summary": {
    "witness_count": 2,
    "transport": "multipeerconnectivity",
    "attestation_strength": "medium"
  },
  "limitations": [
    "Witnesses attest to the encrypted commitment, not the decrypted content.",
    "The MVP does not eliminate collusion.",
    "The MVP does not provide legal admissibility certification."
  ]
}